{
  "$schema": "./branding.schema.json",
  "org_name": "Drupal Test Suite",
  "org_short_name": "Drupal Test Suite",
  "org_url": "",
  "support_url": "",
  "report_title_prefix": "Drupal",
  "report_intro_paragraph": "Automated quality and accessibility checks for this site's custom code. Findings are organized by module, theme, and severity so contributors can address what affects users most directly.",
  "report_footer_credit": "Report generated by the Drupal Test Suite"
}
